company_email,company_name,company_id,instrument_type,regulatory_body,sector_name,security_name,status,symbol,website
bishnu.baskota@gibl.com.np,Global IME Bank Limited,2840,Non-Convertible Debentures,Nepal Rastra Bank,Commercial Banks,10.25% GLOBAL IME BANK LTD. DEBENTURE 2080/81,A,GBD80/81,http://www.globalimebank.com
rghpcl@gmail.com,Rasuwagadhi Hydropower Company Limited,2841,Equity,Nepal Hydropower Board,Hydro Power,RASUWAGADHI HYDROPOWER COMPANY LIMITED,A,RHPL,www.rghpcl.com.np
sanjenhcl@gmail.com,SANJEN JALAVIDHYUT COMPANY LTD,2842,Equity,Nepal Hydropower Board,Hydro Power,SANJEN JALAVIDHYUT COMPANY LIMITED,A,SJCL,www.sjcl.com.np
info@sabaikolaghubitta.com,Sabaiko Laghubitta Bittiya Sanstha Limited,2843,Equity,Nepal Rastra Bank,Microfinance,SABAIKO LAGHUBITTA BITTIYA SANSTHA LIMITED,A,SABSL,www.sabaikolaghubitta.com
adhikholalaghubitta@gmail.com,Adhikhola Laghubitta Bittiya Sanstha Limited,2845,Equity,Nepal Rastra Bank,Microfinance,ADHIKHOLA LAGHUBITTA BITTIYA SANSTHA LIMITED,S,AKBSL,www.albs.com.np
pramod.dahal@nmb.com.np,NMB Bank Limited,2850,Non-Convertible Debentures,Nepal Rastra Bank,Commercial Banks,10 % NMB DEBENTURE 2085,A,NMBD2085,http://www.nmb.com.np
deepa@nibl.com.np,Nepal Investment Bank Limited,2851,Non-Convertible Debentures,Nepal Rastra Bank,Commercial Banks,10.5 % NEPAL INVESTMENT DEBENTURE 2082,A,NIBD2082,http://www.nibl.com.np
ghodighoda.mfi@gmail.com,ghodighoda laghubitta bittiya sanstha ltd,2852,Equity,Nepal Rastra Bank,Microfinance,Ghodighoda Laghubitta Bittiya Sanstha Ltd.,S,GGBSL,www.ghodighoda.com.np
bishwapoudel@nbbl.com.np,Nepal Bangladesh Bank Limited,2854,Non-Convertible Debentures,Nepal Rastra Bank,Commercial Banks,10.25% NBBL Debenture 2085,A,NBBD2085,
reporting@tinaumissionbank.com,Tinau Mission Development Bank Ltd,2855,Equity,Nepal Rastra Bank,Development Banks,Tinau Mission Development Bank Limited,S,TMDBL,www.tinaumissionbank.com
laxman.ghimire@sbl.com.np,Siddhartha Bank Limited,2859,Mutual Funds,Nepal Rastra Bank,Commercial Banks,Siddhartha Investment Growth Scheme - 2,A,SIGS2,
info@skdbl.com.np,Saptakoshi Development bank Ltd,2860,Equity,Nepal Rastra Bank,Development Banks,Saptakoshi Development Bank Ltd,A,SAPDBL,www.skdbl.com.np
info@cbilcapital.com,CBIL Capital Limited,2862,Mutual Funds,Nepal Rastra Bank,Mutual Fund,CITIZENS MUTUAL FUND 2,A,CMF2,www.cbilcapital.com
info@nicasiacapital.com,NIC ASIA Capital Ltd,2863,Mutual Funds,Nepal Rastra Bank,Mutual Fund,NIC Asia Balanced Fund,A,NICBF,www.nicasiacapital.com
laxman.ghimire@sbl.com.np,Siddhartha Bank Limited,2864,Non-Convertible Debentures,Nepal Rastra Bank,Commercial Banks,10.25% SBL Debenture 2083,A,SBLD83,
Tika.Bhattarai@mbl.com.np,Machhapuchhre Bank Limited,2866,Non-Convertible Debentures,Nepal Rastra Bank,Commercial Banks,10.25% Machhapuchhre Bank Debenture 2085,A,MBLD2085,http://www.machbank.com
mutualfunds@nmbcl.com.np,NMB Capital Ltd.,2867,Mutual Funds,Nepal Rastra Bank,Mutual Fund,NMB 50,A,NMB50,www.nmbcl.com.np
suraj.shrestha3508@nicasiabank.com,NIC Asia Bank Ltd.,2868,Non-Convertible Debentures,Nepal Rastra Bank,Commercial Banks,10.25% NIC Asia Debenture 2083/84,A,NICD83/84,
suraj.shrestha3508@nicasiabank.com,NIC Asia Bank Ltd.,2869,Non-Convertible Debentures,Nepal Rastra Bank,Commercial Banks,11% NIC Asia Debenture 082/83,A,NICAD8283,
deepak.gautam@bok.com.np,Bank of Kathmandu Ltd.,2870,Non-Convertible Debentures,Nepal Rastra Bank,Commercial Banks,8% BOK Debenture 2079,A,BOKD2079,
suresh.chapagain@ebl.com.np,Everest Bank Limited,2871,Non-Convertible Debentures,Nepal Rastra Bank,Commercial Banks,8% EBL Debenture 2078,A,EBLD2078,
laxman.ghimire@sbl.com.np,Siddhartha Bank Limited,2872,Non-Convertible Debentures,Nepal Rastra Bank,Commercial Banks,10.50% SBL Debenture 2082,A,SBLD2082,
bipin.hada@himalayanbank.com,Himalayan Bank Limited,2873,Non-Convertible Debentures,Nepal Rastra Bank,Commercial Banks,10% Himalayan Bank Debenture 2083,A,HBLD83,
amit.bhandari@prabhubank.com,Prabhu  Bank Limited,2875,Non-Convertible Debentures,Nepal Rastra Bank,Commercial Banks,10.25% Prabhu Bank  Debenture 2086,A,PBLD86,
ishwar.pathak@sunrisebank.com.np,Sunrise Bank Limited,2877,Mutual Funds,Nepal Rastra Bank,Commercial Banks,Sunrise First Mutual Fund,A,SFMF,
ishwar.pathak@sunrisebank.com.np,Sunrise Bank Limited,2878,Non-Convertible Debentures,Nepal Rastra Bank,Commercial Banks,10.25% Sunrise Bank Debenture 2083,A,SRBLD83,
piyush.aryal@laxmibank.com,Laxmi Bank Limited,2879,Non-Convertible Debentures,Nepal Rastra Bank,Commercial Banks,10% Laxmi Bank Debenture 2086,A,LBLD86,
hdhp@wlink.com.np,Himal Dolakha Hydropower Com. Ltd.,2880,Equity,Nepal Hydropower Board,Hydro Power,Himal Dolakha Hydropower Company Limited,A,HDHPC,www.himaldolakhahydro.com
nepalre@ntc.net.np,Nepal Reinsurance Company Limited,2881,Equity,N/A,Others,Nepal Reinsurance Company Limited,A,NRIC,www.nepalre.com.np
sunil.pant@icfcbank.com,ICFC Finance Limited,2882,Non-Convertible Debentures,Nepal Rastra Bank,Finance,12% ICFC Finance Limited Debenture 2083,A,ICFCD83,http://www.icfcbank.com
gfcl@gfcl.com,Goodwill Finance Co. Ltd.,2883,Non-Convertible Debentures,Nepal Rastra Bank,Finance,12 % Goodwill Finance Limited Debenture 2083,A,GWFD83,
narendra.chhatkuli@kumaribank.com,Kumari Bank Limited,2885,Non-Convertible Debentures,Nepal Rastra Bank,Commercial Banks,10.25% KBL Debenture 2086,A,KBLD86,http://www.kumaribank.com
cs@adbl.gov.np,Agriculture Development Bank Limited,2886,Non-Convertible Debentures,Nepal Rastra Bank,Commercial Banks,10.35% Agricultural Bank Debenture 2083,A,ADBLD83,
prahlad.niraula@nicasiabank.com,NIC ASIA Laghubitta Bittiya Sanstha Limited,2887,Equity,Nepal Rastra Bank,Microfinance,NIC ASIA Laghubitta Bittiya Sanstha Limited,A,NICLBSL,www.nicasialaghubitta.com
rajendra.shrestha@ctznbank.com,Citizen Bank International Limited,2889,Non-Convertible Debentures,Nepal Rastra Bank,Commercial Banks,10.25% Citizens Bank Debenture 2086,A,CIZBD86,
law@nsbl.com.np,Nepal SBI Bank Limited,2890,Non-Convertible Debentures,Nepal Rastra Bank,Commercial Banks,10% Nepal SBI Bank Debenture 2086,A,SBIBD86,
prakash.basukala@nabilbank.com,Nabil Bank Limited,2892,Non-Convertible Debentures,Nepal Rastra Bank,Commercial Banks,10% Nabil Debenture 2082,A,NBLD82,
bp.upadhayay@ajodinsurance.com,Ajod Insurance Ltd,2893,Equity,Nepal Insurance Board,Non Life Insurance,Ajod Insurance Limited,A,AIL,www.ajodinsurance.com
suraj.shrestha3508@nicasiabank.com,NIC Asia Bank Ltd.,2895,Non-Convertible Debentures,Nepal Rastra Bank,Commercial Banks,9% NIC Asia Debenture 2081/82,A,NICAD8182,
resham.sadhana@gmail.com,Sadhana Laghubitta Bittyia Sanstha Limited,2896,Equity,Nepal Rastra Bank,Microfinance,Sadhana Laghubitta Bittiya Sanstha Limited,A,SDLBSL,www.sadhanlaghubitta.com.np
nrninvestmentltd@gmail.com,NRN Infrastructure and Development Limited,2898,Equity,Nepal Rastra Bank,Investment,NRN Infrastructure and Development Limited,A,NRN,www.nrinl.com
muna@relifeinsurance.com,Reliance Life Insurance Limited,2900,Equity,Nepal Insurance Board,Life Insurance,Reliance Life Insurance Limited,A,RLI,www.relifeinsurance.com
info@laxmicapital.com.np,Laxmi Capital Market Limited,2902,Mutual Funds,Nepal Rastra Bank,Mutual Fund,Laxmi Unnati Kosh,A,LUK,www.laxmicapital.com.np
liberty@libertyenergy.com.np,Liberty Energy Company Limited,2903,Equity,Nepal Hydropower Board,Hydro Power,Liberty Energy Company Limited,A,LEC,www.libertyenergy.com.np
amit.bhandari@prabhubank.com,Prabhu  Bank Limited,2904,Non-Convertible Debentures,Nepal Rastra Bank,Commercial Banks,10% Prabhu Bank Debenture 2084 ,A,PBLD84,
ram@generalinsurance.com.np,General Insurance Company Nepal Ltd,2905,Equity,Nepal Insurance Board,Non Life Insurance,General Insurance Company Nepal Ltd,A,GIC,www.gicnepal.com
shivashreehydropowerltd@gmail.com,Shiva Shree Hydropower Limited,2907,Equity,Nepal Hydropower Board,Hydro Power,Shiva Shree Hydropower Ltd,A,SSHL,www.shivashreehdyro.com
sanima@sanimageneral.com,Sanima General Insurance Ltd,2908,Equity,Nepal Insurance Board,Non Life Insurance,Sanima General Insurance Limited,A,SGI,www.sanimageneral.com
laxman.ghimire@sbl.com.np,Siddhartha Bank Limited,2912,Non-Convertible Debentures,Nepal Rastra Bank,Commercial Banks,8.5% SBL Debenture 2084,A,SBLD84,
rajendra.sharma@mountainenergy.com.np,Mountain Energy Nepal Limited,2913,Equity,Nepal Hydropower Board,Hydro Power,Mountain Energy Nepal Limited,A,MEN,www.mountainenergy.com.np
unitedidimardi7mw@gmail.com,United Idi Mardi & RB Hydropower Ltd,2914,Equity,Nepal Hydropower Board,Hydro Power,United IDI Mardi RB Hydropower Limited.,A,UMRH,www.idimardihydro.com.np
info@prabhulife.com,Prabhu Life Insurance Limited,2915,Equity,Nepal Insurance Board,Life Insurance,Prabhu Life Insurance Limited,A,PLI,www.prabhulife.com
jhalak.sharma@chandragirihills.com,Chandragiri Hills Limited,2917,Equity,Ministry of Tourism,Hotels And Tourism,Chandragiri Hills Limited,A,CGH,www.chandragirihills.com
iswor.gautam@nifrabank.com,Nepal Infrastructure Bank Limited,2919,Equity,Nepal Rastra Bank,Investment,Nepal Infrastructure Bank Limited,A,NIFRA,https://www.nifrabank.com
RUDRA@sanimabank.com,Sanima Bank Limited,2922,Non-Convertible Debentures,Nepal Rastra Bank,Commercial Banks,8.5% Sanima Debenture 2087,A,SBD87,
RUDRA@sanimabank.com,Sanima Bank Limited,2923,Mutual Funds,Nepal Rastra Bank,Commercial Banks,Sanima Large Cap Fund,A,SLCF,
info@greenlifehydropower.com.np,Greenlife Hydropower Limited,2924,Equity,Nepal Hydropower Board,Hydro Power,GreenLife Hydropower Limited,A,GLH,www.greenlifehydropower.com.np
mlbsl.nepal@gmail.com,Mahila Laghubitta Bittiya Sanstha Ltd,2925,Equity,Nepal Rastra Bank,Microfinance,Mahila Lagubitta Bittiya Sanstha Limited ,A,MLBSL,www.mlbsl.com.np
ram.thapaliya@jyotilife.com,Jyoti Life Insurance Ltd,2929,Equity,Nepal Insurance Board,Life Insurance,Jyoti Life Insurance Ltd,A,JLI,www.jyotilife.com
deepa@nibl.com.np,Nepal Investment Bank Limited,2931,Non-Convertible Debentures,Nepal Rastra Bank,Commercial Banks,8.5% Nepal Investment Bank Debenture 2084,A,NIBD84,http://www.nibl.com.np
info@manjushreefinance.com.np,Manjushree Finance Ltd.,2932,Non-Convertible Debentures,Nepal Rastra Bank,Finance,9.5% Manjushree Finance Limited Debenture 2085,A,MFLD85,
narendra.chhatkuli@kumaribank.com,Kumari Bank Limited,2933,Mutual Funds,Nepal Rastra Bank,Commercial Banks,Kumari Equity Fund,A,KEF,http://www.kumaribank.com
sudipkhadka321@gmail.com,Singati Hydro Energy Ltd,2934,Equity,Nepal Hydropower Board,Hydro Power,Singati Hydro Energy Limited,A,SHEL,www.singatihydro.com
contact@ruruhydro.com,Ru Ru Jalbidhyut Pariyojana Limited,2935,Equity,Nepal Hydropower Board,Hydro Power,Ru Ru Jalbidhyut Pariyojana Limited,A,RURU,www.ruruhydro.com
contact@,CEDB hydropower development company,3946,Equity,Nepal Hydropower Board,Hydro Power,CEDB hydropower development Company Limited,A,CHDC,www.cedb.com
